{
  "calendars": [
    {
      "backends": {
        "duckdb": {
          "calendar": "gregorian",
          "executable": true
        },
        "metricflow": {
          "executable": true,
          "time_grains": {
            "day": "metric_time__day",
            "month": "metric_time__month",
            "quarter": "metric_time__quarter",
            "week": "metric_time__week",
            "year": "metric_time__year"
          }
        }
      },
      "completeness_rules": [
        "closed"
      ],
      "id": "calendar",
      "name": "Gregorian calendar",
      "supported_grains": [
        "day",
        "week",
        "month",
        "quarter",
        "year"
      ]
    },
    {
      "backends": {
        "duckdb": {
          "calendar": "fiscal",
          "executable": true
        },
        "metricflow": {
          "executable": true,
          "time_grains": {
            "month": "metric_time__month",
            "quarter": "metric_time__quarter",
            "year": "metric_time__year"
          }
        }
      },
      "completeness_rules": [
        "closed"
      ],
      "id": "fiscal",
      "name": "Corporate fiscal calendar",
      "supported_grains": [
        "month",
        "quarter",
        "year"
      ]
    }
  ],
  "dimensions": [
    {
      "allowed_values": [
        "North America",
        "EMEA",
        "Asia Pacific"
      ],
      "backends": {
        "duckdb": {
          "column": "region",
          "table": "customer_dim"
        },
        "metricflow": {
          "filter_name": "customer__region",
          "group_by": "customer__region"
        }
      },
      "entity": "customer",
      "id": "region",
      "name": "Region",
      "type": "string"
    },
    {
      "allowed_values": [
        "United States",
        "Germany",
        "Japan"
      ],
      "backends": {
        "duckdb": {
          "column": "country",
          "table": "agent_dim"
        },
        "metricflow": {
          "filter_name": "agent__country",
          "group_by": "agent__country"
        }
      },
      "entity": "agent",
      "id": "country",
      "name": "Country",
      "type": "string"
    },
    {
      "allowed_values": [
        "standard",
        "premium",
        "enterprise"
      ],
      "backends": {
        "duckdb": {
          "column": "support_tier",
          "table": "incident_dim"
        },
        "metricflow": {
          "filter_name": "incident__support_tier",
          "group_by": "incident__support_tier"
        }
      },
      "entity": "incident",
      "id": "support_tier",
      "name": "Support Tier",
      "type": "string"
    },
    {
      "allowed_values": [
        "email",
        "chat",
        "phone"
      ],
      "backends": {
        "duckdb": {
          "column": "channel",
          "table": "customer_dim"
        },
        "metricflow": {
          "filter_name": "customer__channel",
          "group_by": "customer__channel"
        }
      },
      "entity": "customer",
      "id": "channel",
      "name": "Channel",
      "type": "string"
    },
    {
      "allowed_values": [
        "billing",
        "technical",
        "account access"
      ],
      "backends": {
        "duckdb": {
          "column": "queue",
          "table": "agent_dim"
        },
        "metricflow": {
          "filter_name": "agent__queue",
          "group_by": "agent__queue"
        }
      },
      "entity": "agent",
      "id": "queue",
      "name": "Queue",
      "type": "string"
    },
    {
      "allowed_values": [
        "low",
        "high",
        "urgent"
      ],
      "backends": {
        "duckdb": {
          "column": "priority",
          "table": "incident_dim"
        },
        "metricflow": {
          "filter_name": "incident__priority",
          "group_by": "incident__priority"
        }
      },
      "entity": "incident",
      "id": "priority",
      "name": "Priority",
      "type": "string"
    },
    {
      "allowed_values": [
        "SEV-1",
        "SEV-2",
        "SEV-3"
      ],
      "backends": {
        "duckdb": {
          "column": "severity",
          "table": "customer_dim"
        },
        "metricflow": {
          "filter_name": "customer__severity",
          "group_by": "customer__severity"
        }
      },
      "entity": "customer",
      "id": "severity",
      "name": "Severity",
      "type": "string"
    },
    {
      "allowed_values": [
        "open",
        "pending",
        "resolved"
      ],
      "backends": {
        "duckdb": {
          "column": "status",
          "table": "agent_dim"
        },
        "metricflow": {
          "filter_name": "agent__status",
          "group_by": "agent__status"
        }
      },
      "entity": "agent",
      "id": "status",
      "name": "Status",
      "type": "string"
    },
    {
      "allowed_values": [
        "incident",
        "how-to",
        "billing inquiry"
      ],
      "backends": {
        "duckdb": {
          "column": "issue_type",
          "table": "incident_dim"
        },
        "metricflow": {
          "filter_name": "incident__issue_type",
          "group_by": "incident__issue_type"
        }
      },
      "entity": "incident",
      "id": "issue_type",
      "name": "Issue Type",
      "type": "string"
    },
    {
      "allowed_values": [
        "authentication",
        "reporting",
        "integrations"
      ],
      "backends": {
        "duckdb": {
          "column": "product_area",
          "table": "customer_dim"
        },
        "metricflow": {
          "filter_name": "customer__product_area",
          "group_by": "customer__product_area"
        }
      },
      "entity": "customer",
      "id": "product_area",
      "name": "Product Area",
      "type": "string"
    },
    {
      "backends": {
        "duckdb": {
          "column": "feature",
          "table": "agent_dim"
        },
        "metricflow": {
          "filter_name": "agent__feature",
          "group_by": "agent__feature"
        }
      },
      "entity": "agent",
      "id": "feature",
      "name": "Feature",
      "type": "string"
    },
    {
      "backends": {
        "duckdb": {
          "column": "customer_segment",
          "table": "incident_dim"
        },
        "metricflow": {
          "filter_name": "incident__customer_segment",
          "group_by": "incident__customer_segment"
        }
      },
      "entity": "incident",
      "id": "customer_segment",
      "name": "Customer Segment",
      "type": "string"
    },
    {
      "backends": {
        "duckdb": {
          "column": "account_tier",
          "table": "ticket_dim"
        },
        "metricflow": {
          "filter_name": "ticket__account_tier",
          "group_by": "ticket__account_tier"
        }
      },
      "entity": "ticket",
      "id": "account_tier",
      "name": "Account Tier",
      "type": "string"
    },
    {
      "backends": {
        "duckdb": {
          "column": "language",
          "table": "ticket_dim"
        },
        "metricflow": {
          "filter_name": "ticket__language",
          "group_by": "ticket__language"
        }
      },
      "entity": "ticket",
      "id": "language",
      "name": "Language",
      "type": "string"
    },
    {
      "backends": {
        "duckdb": {
          "column": "agent_team",
          "table": "ticket_dim"
        },
        "metricflow": {
          "filter_name": "ticket__agent_team",
          "group_by": "ticket__agent_team"
        }
      },
      "entity": "ticket",
      "id": "agent_team",
      "name": "Agent Team",
      "policy_tags": [
        "sensitive"
      ],
      "type": "string"
    },
    {
      "backends": {
        "duckdb": {
          "column": "agent_tenure_band",
          "table": "ticket_dim"
        },
        "metricflow": {
          "filter_name": "ticket__agent_tenure_band",
          "group_by": "ticket__agent_tenure_band"
        }
      },
      "entity": "ticket",
      "id": "agent_tenure_band",
      "name": "Agent Tenure Band",
      "type": "string"
    },
    {
      "backends": {
        "duckdb": {
          "column": "shift",
          "table": "ticket_dim"
        },
        "metricflow": {
          "filter_name": "ticket__shift",
          "group_by": "ticket__shift"
        }
      },
      "entity": "ticket",
      "id": "shift",
      "name": "Shift",
      "type": "string"
    },
    {
      "backends": {
        "duckdb": {
          "column": "resolution_code",
          "table": "ticket_dim"
        },
        "metricflow": {
          "filter_name": "ticket__resolution_code",
          "group_by": "ticket__resolution_code"
        }
      },
      "entity": "ticket",
      "id": "resolution_code",
      "name": "Resolution Code",
      "type": "string"
    },
    {
      "backends": {
        "duckdb": {
          "column": "escalation_reason",
          "table": "ticket_dim"
        },
        "metricflow": {
          "filter_name": "ticket__escalation_reason",
          "group_by": "ticket__escalation_reason"
        }
      },
      "entity": "ticket",
      "id": "escalation_reason",
      "name": "Escalation Reason",
      "type": "string"
    },
    {
      "backends": {
        "duckdb": {
          "column": "contact_reason",
          "table": "ticket_dim"
        },
        "metricflow": {
          "filter_name": "ticket__contact_reason",
          "group_by": "ticket__contact_reason"
        }
      },
      "entity": "ticket",
      "id": "contact_reason",
      "name": "Contact Reason",
      "type": "string"
    },
    {
      "backends": {
        "duckdb": {
          "column": "sla_policy",
          "table": "ticket_dim"
        },
        "metricflow": {
          "filter_name": "ticket__sla_policy",
          "group_by": "ticket__sla_policy"
        }
      },
      "entity": "ticket",
      "id": "sla_policy",
      "name": "Sla Policy",